,Headline,Description,Category,polarity,subjectivity
90,Bangabandhu built Bangladesh out of love of its people: Justin Trudeau,Canadian Prime Minister Justin Trudeau today said the independent and democratic Bangladesh was built based on Father of the Nation Bangabandhu Sheikh Mujibur Rahman's love for his people.,Bangladesh,Positive,0.3625
91,"Bangabandhu designed Bangladesh flag to resemble Japan's, like we are brothers: Japanese PM","Bangabandhu had made tremendous efforts to strengthen bilateral ties after the independence of Bangladesh, said Japanese Prime Minister Yoshihide Suga in a video message today.",Bangladesh,Positive,0.5
92,"No more looking back, only marching forward: PM says",Prime Minister Sheikh Hasina today said there was no chance for Bangladesh to look back as it was the time to march forward.,Bangladesh,Neutral,0.0
93,Bangabandhu's birth centenary: BRTC launches special Tungipara-Mujibnagar bus service,Bangladesh Road Transport Corporation today launched a special bus service between Tungipara of Gopalganj and Mujibnagar of Meherpur to mark the birth centenary of Bangabandhu Sheikh Mujibur Rahman.,Bangladesh,Positive,0.5714285714285714
94,"10-day celebration of Bangabandhu's birth centenary, golden jubilee of independence begins at Parade Square",The nation today began a 10-day celebration of Father of the Nation Bangabandhu Sheikh Mujibur Rahman's birth centenary coinciding with the golden jubilee of independence with a grand ceremony at the National Parade Square in Dhaka.,Bangladesh,Positive,0.5777777777777778
95,"Birth Anniversary: President, PM pay homage to Bangabandhu","President Abdul Hamid and Prime Minister Sheikh Hasina today paid tributes to Father of the Nation Bangabandhu Sheikh Mujibur Rahman, marking his birth anniversary and the National Children's Day-2021, by placing wreaths at the portrait of the great leader.",Bangladesh,Positive,0.75
96,For Mujib Borsho PM Sheikh Hasina calls for pledge to make Bangladesh a peaceful abode,Prime Minister Sheikh Hasina has called upon all to take a vow in the Mujib Borsho to take Bangladesh to newer heights in the international arena and transform the country into a safe and peaceful abode for the next generation.,Bangladesh,Positive,0.25
97,Crop field mosaic honouring Bangabandhu makes it to Guinness World Records,Crop field mosaic honouring Bangabandhu Sheikh Mujibur Rahman in Bangladesh has made it to the Guinness World Records.,Bangladesh,Neutral,0.0
98,"Ecnec okays Tk 4,123cr project to build homes for insolvent freedom fighters","The government today approved a Tk 4,123 crore project for constructing 30,000 homes for insolvent valiant freedom fighters and family members of the martyred in a bid to uplift their socioeconomic condition.",Bangladesh,Neutral,0.0
99,Bangabandhu was a champion of human rights: Ban-ki Moon,Former UN secretary-general Ban-ki Moon has said Bangabandhu Sheikh Mujibur Rahman was a champion of human rights not only within Bangladesh but across the globe.,Asia,Neutral,0.3666666666666667
100,"Sedition case filed against BNP leader Minu, 4 others","A sedition case was filed against BNP leader Mizanur Rahman Minu, also an adviser to BNP chairperson Khaleda Zia, and four other party leaders today.",Law & Our Rights,Negative,0.375
101,"10-day state programme: Itinerary of foreign heads of states, governments","Five dignitaries are set to arrive for the celebrations – Maldives President Ibrahim Mohamed Solih, Sri Lanka Prime Minister Mahinda Rajapaksa, Nepalese President Bidya Devi Bhandari, Bhutanese Prime Minister Dr Lotay Tshering and Indian Prime Minister Narendra Modi.",Bangladesh,Neutral,0.0
102,Restrict movement during the 10-day state programme: IGP requests city-dwellers,The Inspector General of Police (IGP) Benazir Ahmed has requested people to restrict their movement “unless urgent” during the 10-day state programme from March 17 to 26 to mark the birth centenary of Bangabandhu Sheikh Mujibur Rahman and the golden jubilee of independence.,Bangladesh,Positive,0.5
103,President summons JS session on April 1,President M Abdul Hamid today issued an order to start the second session of 2021 on April 1.,Bangladesh,Neutral,0.0
104,10-day state celebration: Dhaka ready to welcome global leaders,Bangladesh is set to wear a festive look ahead of a 10-day special programme -- marking 50 years of independence and the birth centenary of Father of the Nation Bangabandhu Sheikh Mujibur Rahman -- set to begin on March 17 at Parade Ground.,Bangladesh,Positive,0.4023809523809524
105,Bangabandhu's portrait on green canvas will be a unique celebration of his birth centenary: agriculture minister,Agriculture Minister Abdur Razzak today said that the portrait of Bangabandhu made using green paddy fields will be a unique celebration of his birth centenary.,Bangladesh,Positive,0.65
106,DIG Monirul Islam made Additional IGP of Special Branch,"Deputy Inspector General (DIG) Monirul Islam, also chief of Counter Terrorism and Transnational Crime (CTTC) unit under Dhaka Metropolitan Police, has been made Additional Inspector General of Police (current charge) of the Special Branch.",Bangladesh,Positive,0.4928571428571428
107,Power distribution in Dhaka to be fully automated: Nasrul Hamid,"A move is underway to make the power distribution system in Dhaka city fully automated to better address the complaints of consumers, State Minister for Power, Energy and Mineral Resources Nasrul Hamid has said.",City,Positive,0.5
108,Bangladesh and Australia want to deepen economic cooperation,Bangladesh and Australia have expressed interest in deepening and widening the economic cooperation between the two countries in a shift from aid to trade relations as the South Asian nation will graduate from the least developed country (LDC) category by 2024.,Business,Positive,0.22500000000000003
109,10-day Mujib Borsho and independence celebrations at Parade Square from March 17: home minister,"The government has chalked out a 10-day long programme at the National Parade Square to mark the birth centenary of Bangabandhu and the golden jubilee of independence, which will be attended by heads of states and governments of different countries.",Bangladesh,Neutral,0.43333333333333335
110,"Bangabandhu's March 7 speech: Bangladesh mission in London unveils first Irish, Welsh and Scottish translations","The Bangladesh High Commission in London has unveiled the first translations of Bangabandhu Sheikh Mujibur Rahman's March 7 speech in Irish, Scottish and Welsh languages in a special publication titled “A call for freedom in languages”.",Bangladesh,Positive,0.3611904761904762
111,Man arrested over rape in Chandpur,Police yesterday arrested a Jubo League activist in a case filed over raping a woman in Faridganj upazila of Chandpur.,Crime,Neutral,0.0
112,PM blasts BNP for remarks on March 7 speech,Prime Minister Sheikh Hasina came down heavily on BNP leaders for their remarks that they did not get any message of independence from the historic March 7 speech.,Bangladesh,Negative,0.262962962962963
113,Bangabandhu 'a towering figure of the 20th century': US top official,"Bangabandhu Sheikh Mujibur Rahman was a “towering figure of the twentieth century” who shaped modern Bangladesh and continues to inspire the people to further develop their country, said Dean Thompson, acting assistant secretary of the Bureau of South and Central Asian Affairs of the US Department of State.",Bangladesh,Positive,0.21000000000000002
114,Gender parity among heads of government to take another 130 years,Women are increasingly entering decision-making positions but full gender parity is far from being reached as they rarely hold leadership positions in executive and legislative offices.,Bangladesh,Positive,0.8166666666666668
115,ACC couldn't meet public expectations: outgoing chairman Iqbal Mahmood,"Anti-Corruption Commission (ACC) could not meet expectations in curbing corruption, its outgoing Chairman Iqbal Mahmood said today.",Bangladesh,Neutral,0.0
116,"E-payment mandatory from July 1 if customs duty on import, export invoices reaches Tk 2 lakh: NBR",The customs duty against import and export invoices amounting to Tk 2 lakh or above will have to be paid online starting from July 1 this year.,Business,Neutral,0.1
117,What makes the 7th March speech one of the best?,"In 2017, UNESCO announced Bangabandhu's March 7 speech as one of the most historic speeches in the world, worthy of being enlisted in the ""Memory of the World Register”. The significance of the speech could not be clearer -- as a nation, Bangalees received a united purpose, a call-to-arms for self-determination, and a pledge to never surrender.",Opinion,Positive,0.5
118,Bangabandhu's March 7 speech is the real declaration of independence: PM,Prime Minister Sheikh Hasina today said that the historic March 7 speech of Father of the Nation Bangabandhu Sheikh Mujibur Rahman was the real declaration of the country's independence.,Bangladesh,Positive,0.15000000000000002
119,Historic 7th March: PM pays homage to Bangabandhu,Prime Minister Sheikh Hasina today paid rich tributes to Father of the Nation Bangabandhu Sheikh Mujibur Rahman on the occasion of the historic March 7.,Bangladesh,Positive,0.375
120,Digital Security Act should be abolished: Dr Kamal Hossain,Gonoforum President Dr Kamal Hossain today said the Digital Security Act should be abolished.,Politics,Neutral,0.0
121,Book on Bangabandhu's March 7 speech published in all UN official languages,Permanent Mission of Bangladesh to UNESCO and Bangladesh Embassy in Paris have published -- in UN's six official languages -- a book on Father of the Nation Bangabandhu Sheikh Mujibur Rahman's March 7 speech.,Bangladesh,Neutral,0.0
122,3rd Dash-8 aircraft reaches Dhaka,The third Dash-8 aircraft purchased from Canada reached Dhaka this afternoon.,Bangladesh,Neutral,0.0
123,Joy Bangla Concert to be back in 2022: Radwan Mujib Siddiq,"The popular Joy Bangla Concert will return in 2022 after it was cancelled this year due to the coronavirus pandemic, said Bangabandhu's grandson Radwan Mujib Siddiq in a Facebook post yesterday.",Bangladesh,Positive,0.4916666666666667
124,Indian Cultural Centre inaugurated in Gulshan,"Shared cultural heritage is the strength of friendship between Bangladesh and India, said Indian External Affairs Minister S Jaishankar today after inaugurating the Indian Cultural Centre in the capital's Gulshan.",Bangladesh,Positive,0.10000000000000002
125,Processions and rallies banned on CMC campus,The authorities of Chattogram Medical College (CMC) have imposed a ban on processions and rallies on the campus as the students locked in clashes twice within the span of a month.,Bangladesh,Neutral,0.0
126,"Begum Rokeya University, Rangpur VC Kalimullah declared persona non grata on campus","Prof Nazmul Ahsan Kalimullah, the vice-chancellor of Begum Rokeya University, Rangpur (BRUR) was declared persona non grata on campus today after he held a press conference in Dhaka.",Bangladesh,Neutral,0.0
127,'Bangabandhu's dynamism and farsightedness shaped foreign policy visions of Bangladesh',"Bangabandhu's dynamism and farsightedness shaped the foreign policy visions of Bangladesh, said eminent speakers at a webinar as part of the celebration of Mujib Year.",Bangladesh,Negative,0.125
128,"UN rights chief urges transparent probe into Mushtaq's death, review of DSA","UN High Commissioner for Human Rights Michelle Bachelet has called for transparent investigation into the death of writer Mushtaq Ahmed and review of the Digital Security Act, under which he was charged.",Bangladesh,Positive,0.2133333333333333
129,Fakhrul receives first Covid-19 vaccine dose at Kuwait Maitree Hospital,BNP Secretary General Mirza Fakhrul Islam Alamgir has received the first dose of coronavirus vaccine.,Coronavirus: A deadly threat,Positive,0.41666666666666663
130,Tarique Rahman sued under DSA,A case was filed against BNP acting chairman Tarique Rahman under the Digital Security Act for declaring late president Ziaur Rahman “the nation's father of Bangladeshi nationalism”.,Politics,Negative,0.19999999999999998
131,25 BNP men released on bail from Khulna jail,Twenty-five leaders and activists of BNP have been released on bail from Khulna jail after they were arrested en masse between February 24 and February 27 from different areas of Khulna ahead of the party's rally in the city held on February 27.,Politics,Negative,0.3
132,Some people trying to fish in troubled waters over Mushtaq's death: Quader,Awami League General Secretary Obaidul Quader today said a section of people is trying to fish in troubled waters over the death of writer Mushtaq Ahmed.,Bangladesh,Negative,0.75
133,5th phase polls underway in 29 municipalities,The fifth phase election is progressing in 29 municipalities under 20 districts across the country today.,Bangladesh,Neutral,0.0
134,5th phase polls to 29 municipalities tomorrow,"The fifth phase elections will be held in 29 municipalities under 20 districts using electronic voting machines (EVMs) on Sunday, February 28, 2021.",Bangladesh,Neutral,0.0
135,"Death of writer Mushtaq: 13 heads of foreign missions urge govt for transparent, independent inquiry","Thirteen heads of foreign missions in Bangladesh have expressed grave concern about the death in custody of writer Mushtaq Ahmed, who died in Kashimpur Jail on Thursday, while calling on the government to conduct an enquiry into the death.",Bangladesh,Negative,0.0625
136,24-hour bus strike to start from 6pm in Khulna ahead of BNP rally,Khulna Bus Owners' Association has called a 24-hour strike starting from this evening ahead of BNP's divisional rally.,Bangladesh,Neutral,0.1
137,Mushtaq Ahmed should never have been detained: Human Rights Watch,"Brad Adams, Asia Director of Human Rights Watch, today released a statement regarding the devastating death of Mushtaq Ahmed where he said the writer should not have been detained in the first place.",Bangladesh,Negative,0.4777777777777778
138,Momen calls upon US to help legalise undocumented Bangladeshis,Foreign Minister AK Abdul Momen has called upon US authorities to help legalise undocumented Bangladeshis residing there.,Bangladesh,Negative,0.125
139,12th anniversary of Pilkhana carnage tomorrow,The 12th anniversary of the atrocious carnage at the Pilkhana Bangladesh Rifles (now Border Guard Bangladesh) headquarters in the capital will be observed tomorrow.,Bangladesh,Negative,1.0
140,"Bangladesh, Japan saw strengthened relation in 2020 despite pandemic: envoy","Despite the pandemic affecting economies and health systems, Bangladesh and Japan last year saw a stronger relationship as the two peace-loving nations worked together for national and regional prosperity and stability.",Bangladesh,Neutral,0.06666666666666667
141,Noted economist Ibrahim Khaled passes away,"Prominent economist and former deputy governor of Bangladesh Bank, Khondkar Ibrahim Khaled passed away at a hospital in Dhaka early today.",Business,Positive,0.43333333333333335
142,"Bangladesh can export edible oil to India, says High Commissioner Doraiswami",Indian High Commissioner to Bangladesh Vikram Kumar Doraiswami has said Bangladesh can export edible oil to India with 20 percent value addition to the product.,Southeast Asia,Positive,0.5399999999999999
143,Al Jazeera report: Court asks complainant to withdraw sedition case,"A Dhaka court today asked the complainant to withdraw a sedition case filed against four people including Swedish-Bangladeshi journalist and Netra News Editor-in-Chief Tasneem Khalil and Hungary-based entrepreneur Zulkarnain Saer Khan alias Sami over Al Jazeera's report titled ""All the Prime Minister's Men"".",Bangladesh,Neutral,0.0
144,Will build our own fighter jets: PM,"Prime Minister Sheikh Hasina today expressed a desire to build fighter jets in Bangladesh, to protect its sovereignty.",Bangladesh,Neutral,0.0
145,Nation paying tributes to language heroes,"The nation is observing Amar Ekushey -- the Language Martyrs' Day (Shaheed Dibosh) and the International Mother Language Day in a befitting manner today, marking the supreme sacrifice of the language heroes for upholding the right to speak their mother tongue Bangla.",Bangladesh,Positive,0.26785714285714285
146,"President, PM pay homage to Language Heroes",President M Abdul Hamid and Prime Minister Sheikh Hasina have paid their glowing tributes to the martyrs of the historic Language Movement in 1952 on the occasion of Amar Ekushey and the International Mother Language Day.,Bangladesh,Neutral,0.0
147,Journalist hit by bullet during Noakhali AL factional clash dies at DMCH,"A local journalist, who was bullet-hit in clashes between two factions of ruling Awami League over establishing supremacy in Companiganj upazila of Noakhali, died at a Dhaka hospital.",Crime,Neutral,0.0
148,Recommendation to suspend Quader Mirza withdrawn hours after being issued,Noakhali district unit of Awami League withdrew a letter recommending withdrawal and suspension of Basurhat Municipality Mayor Abdul Quader Mirza from all activities of the party two hours after issuing it.,Politics,Neutral,0.0
149,50 hurt in AL factional clash in Companiganj,At least 50 people were injured in a clash between two rival factions of ruling Awami League in Noakhali's Companiganj upazila.,Politics,Negative,0.4
150,"5 hurt in clash between JU students, locals","At least five persons were injured, including students of Jahangirnagar University in Savar on the outskirts of Dhaka, in a clash between locals and students.",Bangladesh,Negative,0.4
151,Process underway to take action against Papul,The process of taking action against independent Laxmipur-2 lawmaker Mohammad Shahid Islam alias Kazi Papul has been started as documents and other papers on his conviction in a Kuwait court has reached the parliament secretariat.,Bangladesh,Negative,0.19999999999999998
152,India-Bangladesh collaboration: Software to translate SC judgments from English to Bangla unveiled,"The Supreme Court today unveiled 'Amar Vasha' software, which uses artificial intelligence to translate orders and judgments of the apex court from English into Bangla.",Bangladesh,Negative,0.5
153,"'Int'l Mother Language Day inspiration to build multicultural, inclusive societies'","International Mother Language Day is a source of inspiration to build multicultural and inclusive societies where people of all races, faiths, languages and cultures get respect and can live with dignity, ministers and academics said today.",Bangladesh,Positive,0.25
154,"Al-Jazeera documentary: Make sure it's taken down, HC tells BTRC","Exercising an extraordinary jurisdiction, the High Court has directed the telecom regulator to immediately remove Al Jazeera report ""All the Prime Minister's Men"" from online platforms in order to prevent “further worsening of the situation”.",Law & Our Rights,Positive,0.68
155,9 UK universities keen to set up campuses in Bangladesh,At least nine UK universities want to set up campuses in Bangladesh to provide higher education of international standard.,Bangladesh,Negative,0.225
156,PM urges all to be vigilant against conspiracy,Prime Minister Sheikh Hasina today urged all countrymen to keep vigil against conspiracy.,Bangladesh,Neutral,0.0
157,Present authentic Liberation War history before new generation: Hasina,Prime Minister Sheikh Hasina today asked all concerned to present the authentic history of the Liberation War before the new generation.,Bangladesh,Positive,0.40151515151515155
158,Journalist Shaheen Reza Nur passes away,"Shaheen Reza Nur, former executive editor of the daily Ittefaq and elder son of Shaheed journalist Sirajuddin Hossain, died of cancer at the age of 67.",Bangladesh,Neutral,0.0
159,Planning minister criticises govt officials for delay in disposal of files,"Criticising government officials for the delay in disposal of files, Planning Minister MA Mannan said, “If you (govt officials) take salary and benefits, you have to work fast and on time”.",Bangladesh,Positive,0.6
160,21 eminent citizens call for correcting errors concerning Jamaat-e-Islami in secondary level textbook,Twenty-one eminent citizens of the country called upon authorities to rectify some errors in a chapter on Bangladeshi political parties in a secondary level textbook on civics in grades IX and X.,Bangladesh,Negative,0.2
161,"Stripping Zia of Bir Uttam title: We will now look into the legal aspects, says Muktijoddha Council",A probe body of Jatiya Muktijoddha Council will meet soon to look into the legal aspects of revoking gallantry awards given to late president Ziaur Rahman and killers of Bangabandhu and their patronisers.,Bangladesh,Negative,0.4
162,JS body for sedition charges against those spreading propaganda through social media,A parliamentary body today recommended to take necessary actions against Bangladeshi citizens at home and abroad under sedition law for spreading propaganda through social media against the country.,Bangladesh,Negative,0.3888888888888889
163,UN human rights experts call to stop construction of tourism resort in Bandarban,UN human rights experts have said that Bangladesh should suspend the construction of a large-scale tourist resort in the Chittagong Hills Tracts because it “threatens to dispossess the indigenous Mro peoples of their traditional lands and cause serious environmental damage”.,Bangladesh,Negative,0.5055555555555555
164,Dhaka-Aricha highway to be upgraded to 10-lane: Quader,Road Transport and Bridges Minister Obaidul Quader today said the government has taken an initiative to upgrade nearly 20 kilometers (Gabtoli to Nabinagar) of Dhaka-Aricha highway from four-lane to 10-lane.,Bangladesh,Positive,0.4
165,Bangladesh envoy to UK awarded Woman of the Decade in Public Life and Diplomacy 2021,Bangladesh High Commissioner to the United Kingdom and Ireland Saida Muna Tasneem has been awarded the “Woman of the Decade in Public Life and Diplomacy 2021” by the Women's Indian Chamber of Commerce and Industries (WICCI).,Bangladesh,Positive,0.3033333333333333
166,Bangabandhu's Feb 6 speech in Kolkata: Memorial meeting at parade ground tomorrow,"Prime Minister Sheikh Hasina today said Father of the Nation Bangabandhu Sheikh Mujibur Rahman's historic speech delivered at the Brigade Parade Ground in Kolkata on February 6, 1972 is a very significant one in the history of Bangladesh.",Bangladesh,Positive,0.41111111111111115
167,Bangladesh's agro products: PM for further research to expand market,Prime Minister Sheikh Hasina today asked agricultural scientists to conduct further research over local fruits and agricultural items to expand their market.,Bangladesh,Neutral,0.25
168,EIU's Democracy Index: Bangladesh moves 4 notches up,Bangladesh has ranked 76th on the Economist Intelligence Unit's Democracy Index 2020 -- four notches up from last year.,Bangladesh,Neutral,0.06666666666666667
169,"MJF, in assistance with UK, provides cash support to over 15,000 Covid-19 affected women","Manusher Jonno Foundation (MJF), a human rights organisation focusing on dignity and well-being of marginalised population, has begun distribution of livelihood support to 15,380 Covid-19 affected marginalised women in 35 districts under 'Excluded People's Rights in Bangladesh' (EPR) programme.",Bangladesh,Neutral,0.1
170,This is 'yellow journalism': home minister on Al Jazeera report,Home Minister Asaduzzaman Khan Kamal today said Qatar-based international media Al Jazeera's report is not “factual”.,Bangladesh,Neutral,0.0
171,"Over 100 SC lawyers write to president to probe graft accusations against CEC, election commissioners","One hundred and one lawyers of the Supreme Court today sent a letter to President Md Abdul Hamid, requesting him to constitute a Supreme Judicial Council to probe allegations of ""financial corruption and gross misconduct"" against chief election commissioner (CEC) and other election commissioners and to remove them from their posts.",Bangladesh,Negative,0.125
172,11th Parliament session prorogued today,The 11th session of the 11th Parliament was prorogued today with Speaker Shirin Sharmin Chaudhury reading out the prorogation order of the president around 12:10pm.,Bangladesh,Neutral,0.0
173,Covid-19 makes me feel I'm confined in a big prison: PM tells parliament,"Saying that she feels like she's confined in a big prison due to the Covid-19 situation, Prime Minister Sheikh Hasina today told the parliament that she met everyone during the session and had a wonderful time.",Bangladesh,Positive,0.4916666666666667
174,Dhaka urges Kuala Lumpur to finalise protocol on employment of workers,Bangladesh has urged Malaysia to finalise protocol amending the MoU between the Government of Malaysia and the Government of Bangladesh (G2G plus) on the employment of workers.,Bangladesh,Neutral,0.0
175,"Bangladesh govt terms Al Jazeera report 'false, defamatory and a politically motivated smear campaign'","Bangladesh has termed the Al Jazeera investigative report “All the Prime Minister's Men” as ""false, defamatory and a politically motivated smear campaign"".",Bangladesh,Negative,0.35
176,Kotalipara bomb plot to kill Hasina: HC to deliver verdict Feb 17,The High Court will deliver its verdict on February 17 in the case filed over the attempt to kill Awami League President and Prime Minister Sheikh Hasina by planting a 76 kg bomb at Kotalipara of Gopalganj in 2000.,Law & Our Rights,Positive,0.5399999999999999
177,Freedom of press essential for democracy: JP MP Anisul,Jatiya Party lawmaker Anisul Islam Mahmud told parliament today that it would not be good for the country or the government if freedom of press is not ensured.,Bangladesh,Positive,0.6000000000000001
