,Headline,Description,Category,polarity,subjectivity
178,Case against Nasir Group officials: HC wants to know why BFIU failed to complete probe in 4 years,"The High Court yesterday wanted to know why the Bangladesh Financial Intelligence Unit (BFIU), the anti-money laundering wing of the Bangladesh Bank, has failed to complete -- in last four years -- the investigation into a money laundering case filed against four high officials of Nasir Group of Industries.",Law & Our Rights,Negative,0.3077777777777777
179,Road accidents: Govt urged to make trustee board functional for compensation claims,Bangladesh Jatri Kalyan Samity today demanded that the government make the trustee board functional immediately which will deal with compensation related issues after accidents.,Bangladesh,Neutral,0.4
180,"Manpower export to different Middle East countries slowly reopening, says Expatriate minister",Expatriate Minister Imran Ahmad today informed the parliament that manpower export to different Middle East destinations including UAE is reopening gradually.,Bangladesh,Neutral,0.3
181,"Bangladesh, India to hold secretary-level talks in March",Bangladesh and India today agreed to hold a series of secretary-level talks. These talks will include Joint Rivers Commission in the run up to the summit meeting between Prime Minister Sheikh Hasina and her counterpart Narendra Modi in Dhaka this March.,Bangladesh,Neutral,0.0
182,AL's career workshop garners huge response among youth,Bangladesh Awami League's initiative “Career Workshop” has attracted the country's youth and has been receiving a huge response since its inauguration on January 9.,Bangladesh,Positive,0.9
183,Bangladesh wants BIMSTEC to fulfill Bangabandhu's dream of regional cooperation: Foreign minister,Foreign Minister Dr AK Abdul Momen today emphasised on the implementation of the (Bay of Bengal Initiative for Multi-Sectoral Technical and Economic Cooperation) BIMSTEC Master Plan for transport connectivity for the greater benefit of this region.,Bangladesh,Positive,0.23125
184,Some aggrieved journalists publish negative news over NID services: law minister,"Some “aggrieved” journalists publish “incorrect” news over public hassles while availing services regarding national identity card, Law Minister Anisul Huq informed the parliament today.",Bangladesh,Neutral,0.06666666666666667
185,Mamata trying to create 'Greater Bangladesh' through 'Jai Bangla' slogan: West Bengal BJP president,President of West Bengal unit of Bharatiya Janata Party (BJP) Dilip Ghosh alleged in a Facebook post today that state Chief Minister Mamata Banerjee was trying to create a “Greater Bangladesh” by raising “Jai Bangla” slogan at her public meetings.,INDIA,Positive,0.2222222222222222
186,"New Biden administration: Dhaka hopeful for Rohingya repatriation, restoring GSP facilities","Dhaka sees a ray of hope for Rohingya repatriation and restoring GSP facilities as the new US President Joe Biden is focusing on promoting democratic institutions, human rights and is supportive of the developing countries' cause.",Bangladesh,Positive,0.5181818181818182
187,India and Bangladesh must progress together: Indian high commissioner,"India and Bangladesh must progress together, Indian High Commissioner to Bangladesh Vikram Doraiswami said today, as India celebrates its 72nd Republic Day.",Bangladesh,Positive,0.5399999999999999
188,Padma bridge construction to end by June 2022: Obaidul Quader,Road Transport and Bridges Minister Obaidul Quader informed the parliament today that the construction of Padma bridge would be completed within June 2022.,Bangladesh,Neutral,0.0
189,President consents to three education bills,President Abdul Hamid today gave his consent to the three bills passed by the Jatiya Sangsad during the ongoing 11th session of parliament.,Bangladesh,Neutral,0.0
190,"Grade 10, 12 students will have regular classes, rest once a week: education minister",Education Minister Dipu Moni today informed the parliament that classes at schools will resume on a limited scale.,Bangladesh,Negative,0.14285714285714285
191,"HSC, equivalent results without exams: bills passed in parliament","Three separate amendment bills were passed in the parliament, paving the way for publishing HSC and equivalent results without holding public exams during the pandemic.",Bangladesh,Neutral,0.06666666666666667
192,This is our biggest celebration: PM says while giving away homes to homeless,Prime Minister Sheikh Hasina today said that her government would ensure accommodation for all marking Mujib Borsho.,Bangladesh,Neutral,0.0
193,"Bangabandhu's murals set up in 62 districts, 383 upazilas: cabinet division tells HC","The cabinet division today submitted a report to the High Court, saying that murals of Father of the Nation Bangabandhu Sheikh Mujibur Rahman have been placed in 62 districts and 383 upazilas across the country in line with its earlier directive.",Bangladesh,Positive,0.52
194,"Covid-19: Govt to gradually vaccinate all Bangladeshis over 18 for free, finance minister says","Covid-19 vaccine will be provided to all Bangladeshi citizens -- aged above 18 -- for free, Finance Minister AHM Mustafa Kamal said today.",Coronavirus: A deadly threat,Positive,0.43333333333333335
195,"Outstanding bills of 6 gas distribution companies stand at Tk 9,018cr","The outstanding bills of six gas distribution companies of the country amount to Tk 9,018.04 crore, State Minister for Power, Energy and Mineral Resources Nasrul Hamid told parliament today.",Bangladesh,Positive,0.875
196,No decision on shutting down sugar mills: Industries Minister Nurul Majid,Industries Minister Nurul Majid Mahmud Humayun today told parliament that the government did not take any decision on shutting down state-owned sugar mills.,Bangladesh,Negative,0.2888888888888889
197,"Government to build 14,000 houses for insolvent freedom fighters","The government will construct 14,000 houses for insolvent freedom fighters, said Liberation War Affairs Minister AKM Mozammel Haque today while addressing a rally on the occasion of “Service Week-2021” in front of the ministry.",Bangladesh,Neutral,0.0
198,Britain expresses solidarity with Bangabandhu's secular values at Victory Day celebration in London,"Bangladesh High Commission in London organised a high-profile Victory Day celebration programme on December 16, where participants including eminent British parliamentarians, ambassadors, senior officials of UK Foreign Office and recipients of Friends of Liberation War honour paid their profound homage to Father of the Nation Bangabandhu Sheikh Mujibur Rahman and expressed solidarity with Prime Minister Sheikh Hasina's commitment to uphold Bangabandhu's secular, progressive and pluralistic values in sustaining Bangladesh's growth and prosperity.",Bangladesh,Positive,0.41625
199,Bangladesh hopeful of continuing talks on economic ties with US,Bangladesh is hopeful of continuing discussion with the United States on strengthening economic ties as election results are unlikely to have any impact on it.,Bangladesh,Negative,0.35
200,"Flights to India to resume soon, Indian envoy hopes","Indian High Commissioner to Dhaka, Vikram Doraiswami, says that he is hopeful about resuming air operation between India and Bangladesh ""very quickly.""",World,Positive,0.595
201,Radwan Mujib to launch policy magazine 'WhiteBoard' tomorrow,"Centre for Research & Information (CRI) is set to launch WhiteBoard, a magazine objectively and comprehensively analysing and narrating the policies in Bangladesh, tomorrow.",Bangladesh,Neutral,0.1
202,Involvement with Neo JMB: Mother of arrested Indian national wants punishment,"The mother of 25-year-old Indian national Ayesha Jannat Mohona who was arrested in Dhaka for her alleged links to terror group Jamaat-ul-Mujahideen Bangladesh, wants strong action against her as per the law.",INDIA,Positive,0.25833333333333336
203,Doctor from Kushtia dies of Covid-19 at BSMMU,Another doctor dies from Covid-19 while receiving treatment at Bangabandhu Sheikh Mujib Medical University.,Coronavirus: A deadly threat,Neutral,0.0
204,"PM, law minister mourn death of president's brother Abdul Hai","Prime Minister Sheikh Hasina and Law Minister Anisul Huq mourn the demise of freedom fighter Abdul Hai, younger brother of President Abdul Hamid, who died from Covid-19 infection in Dhaka.",Coronavirus: A deadly threat,Neutral,0.0
205,Trial run begins for transshipment of Indian goods through Bangladesh waters,"The transshipment of Indian goods will open a new horizon of Indo-Bangla relations, says State Minister for Shipping, Khalid Mahmud Chowdhury.",Bangladesh,Positive,0.4772727272727273
206,India's apex court to hear pleas of blacklisted foreigners including 110 Bangladeshis,"India's Supreme Court says it will hear on July 24 the pleas filed by foreigners, challenging the federal government's orders that blacklisted more than 2,700 citizens of 35 countries from travelling to India for 10 years for alleged involvement in Tablighi Jamaat activities.",INDIA,Positive,0.5333333333333333
207,RU Prof Historian ABM Hossain no more,"Internationally acclaimed historian Professor Abul Bashar Mosarraf Hossain of Rajshahi University (RU) passed away at Bangladesh Specialised Hospital in Dhaka, Prof Fazlul Haque, Dean of the Faculty of Arts at RU, says.",Bangladesh,Neutral,0.0
208,MP Shahid's seat will be vacant if Kuwait citizenship proven: PM,Prime Minister Sheikh Hasina tells the parliament that the seat of independent MP Mohammad Shahid Islam will be vacant if it is found that he is a citizen of Kuwait.,Bangladesh,Neutral,0.125
209,Sahara Khatun flies to Thailand for treatment,Awami League (AL) presidium member and former home minister Advocate Sahara Khatun leaves Dhaka for Thailand for better treatment.,Country,Positive,0.25
210,Bangladesh's independence AL's biggest achievement: PM,Prime Minister Sheikh Hasina says the biggest achievement of Awami League through its sacrifices and endurance is the liberation of Bangladesh.,Bangladesh,Neutral,0.0
211,Covid-19 positive health workers to get priority at Sheikh Russel Gastro Liver Hospital,Sheikh Russel Gastro Liver Institute and Hospital in Dhaka is designated for priority treatment of coronavirus-positive health workers.,Coronavirus: A deadly threat,Neutral,0.0
212,BEZA provides relief to 7000 workers' families,"Bangladesh Economic Zones Authority (BEZA) provides food assistance to some 7,000 families who work at different ongoing economic zones and whose livelihoods are affected by the prolonged nationwide shutdown due to the coronavirus outbreak.",Business,Positive,0.34375
213,"Amphan floods houses, fish enclosures; destroys WDB embankment in Bagerhat",The embankment of 35/1 polder of Water Development Board (WDB) in Sharankhola upazila of Bagerhat collapses in many places after being hit by super cyclone Amphan.,Country,Positive,0.5833333333333333
214,National Professor Anisuzzaman laid to rest,National Professor Anisuzzaman is laid to rest at Dhaka's Azimpur graveyard.,Bangladesh,Neutral,0.0
215,Canada for global alliance to combat fallout from coronavirus pandemic,Canada proposes a global alliance to tackle the challenges in the aftermath of the coronavirus pandemic.,Coronavirus: A deadly threat,Neutral,0.0
216,Gonoshasthaya Kendra gives 200 rapid testing kits to BSMMU,Gonoshasthaya Kendra gives Bangabandhu Sheikh Mujib Medical University (BSMMU) 200 locally developed rapid testing kits for validation.,Coronavirus: A deadly threat,Positive,0.15
217,Media more important than ever during Covid-19 crisis: foreign diplomats,"At least nine foreign diplomats in Bangladesh take to social media, calling for upholding the freedom of expression and saying facts, during any crisis, are more important than ever to save lives.",Bangladesh,Positive,0.41833333333333333
218,Cooperation and not isolation will help us fight Covid-19: PM Sheikh Hasina,"As the world tackles Covid-19 pandemic, Prime Minister Sheikh Hasina calls for a new kind of approach that fosters cooperation, and not isolation, among all stakeholders in an article published by the World Economic Forum.",Coronavirus: A deadly threat,Positive,0.5181818181818182
219,"Patuakhali UP chairman, member suspended for 'stealing rice'",A union parishad chairman and a female member of Patuakhali are suspended for allegedly stealing relief rice.,Coronavirus: A deadly threat,Negative,0.13333333333333333
220,High Commission arranging flight to take Australians home from Dhaka,The Australian High Commission in Bangladesh arranges a non-scheduled commercial flight to take back the Australians currently in Bangladesh.,Bangladesh,Positive,0.188
221,"E-passport, new MRP operations suspended","The Department of Immigration and Passports (DIP) suspends electronic and machine-readable passport (MRP) operations, as a precautionary measure to prevent the spread of coronavirus.",Coronavirus: A deadly threat,Neutral,0.0
222,Modi praises Bangabandhu in tweet,"Bangabandhu would be remembered for his courage and indelible contribution, Indian Prime Minister Narendra Modi says in a tweet.",INDIA,Neutral,0.0
223,Govt to introduce 1st int'l grant for young innovators,"The government is going to introduce its first international grant for young innovators as part of celebrating “Mujib Borsho”, says ICT state minister Zunaid Ahmed Palak.",Country,Positive,0.24444444444444446
224,"Sheikh Rehana, Saima Wazed pay homage to Bangabandhu at Kolkata's Baker Hostel","Sheikh Rehana and Saima Wazed Hossain, daughter and granddaughter of Bangabandhu Sheikh Mujibur Rahman, pay homage to the Father of the Nation in Kolkata's Baker Hostel of Maolana Azad College.",World,Neutral,0.0
225,Convicted war criminal Abdus Subhan dead at DMCH,Convicted war criminal and Jamaat-e-Islami leader Abdus Subhan dies of old age complications at Dhaka Medical College Hospital (DMCH).,City,Negative,0.25
226,Rear Admiral Nazmul Hassan new envoy to Maldives,The Government decides to appoint Rear Admiral Nazmul Hassan as the new High Commissioner of Bangladesh to the Republic of Maldives.,Country,Positive,0.4972727272727272
227,We frame each budget with the election manifesto in mind: PM,Prime Minister Sheikh Hasina says Bangladesh has attained an ability to advance further by competing any nation of the world and asserted that none can pull the country backward any more.,Country,Positive,0.5
228,Bangladesh elected as the president of UNICEF Executive Board,"Ambassador Rabab Fatima, Bangladesh's Permanent Representative to the United Nations, has been unanimously elected as the President of the UNICEF Executive Board at the elections of the Bureau held yesterday at the UN Headquarters in New York.",Bangladesh,Positive,0.45454545454545453
229,China's Xi visits Myanmar to drive home Belt and Road plan,"China's President Xi Jinping arrives in Myanmar this week to nail down multi-billion-dollar infrastructure deals in a country abandoned by many in the West appalled at the ""genocide"" of Rohingya Muslims on leader Aung San Suu Kyi's watch.",Rohingya Crisis,Negative,0.5962962962962963
230,Bangladesh top gender-neutral country in South Asia: Report,"Bangladesh has been ranked the top country among its South Asian neighbours by performing the best in bringing down gender gap, World Economic Forum says in its latest report.",Bangladesh,Positive,0.36481481481481487
231,Hearing at ICJ Part-2: Myanmar rebuts with weak logic,"Myanmar argues their case today (11th December 2019), in the International Court of Justice. Aung San Suu Kyi Spoke at the city of The Hague, Netherlands where the court is located. She partially agreed to the allegations of the mistreatment of the Rohingya people. She said, if the military is found guilty of war crime allegations they'd be investigated and trailed by Myanmar.",Star Live,Negative,0.35
232,Stop genocide against Rohingyas: Gambia to UN court,The Gambia accuses Myanmar of breaching the 1948 genocide convention and urged the UN top court to order Myanmar to stop genocide against the Rohingya minority.,Country,Positive,0.5
233,No atrocity against religious minorities in Bangabandhu regime: Amit Shah,Indian Home Minister Amit Shah has expressed his gratitude that not a single incident of atrocities on religious minorities in Bangladesh took place as long as Bangabandhu Sheikh Mujibur Rahman was alive.,Politics,Positive,0.31607142857142856
234,'Long-term plan needed to stop violent extremism',"Stressing the necessity to stop violent extremism with long-term integrated plan, speakers at a conference in Belgium say that the threat is no longer limited in South Asia, rather Europe and the US are also affected by its destructive impacts.",World,Negative,0.580952380952381
235,Bangladesh allows India to withdraw Feni river water,Bangladesh has agreed to allow India to withdraw 1.82 cusec of water from trans-border Feni river to meet the demand of drinking water for the people of of Tripura's Sabroom town.,Politics,Neutral,0.0
236,PM urges India-Bangladesh businessmen to work for mutual benefits,"Prime Minister Sheikh Hasina urges India-Bangladesh businessmen to work for mutual benefits and make the region more prosperous, saying the two neighbouring countries are enjoying the best ever relations as she addressed the India-Bangladesh Business Forum (IBBF).",Country,Positive,0.46666666666666673
237,World News Day: How newsrooms made an impact in society,Editors and journalists in newsrooms around the world have come together to showcase some of the work they do and the effort that goes into producing stories that make a difference to the lives of people in their communities.,World,Neutral,0.0
238,PM receives 'Champion of Skill Development for Youth' award,Prime Minister Sheikh Hasina receives an award titled 'Champion of Skill Development for Youth' for Bangladesh's great success in youth skill development.,Country,Positive,0.375
239,Bangladeshi shot dead in New York,A Bangladeshi youth has been shot dead by miscreants in Jamaica of New York.,Bangladesh,Negative,0.42727272727272725
240,"Rohingya Crisis: Dhaka seeks NAM, ASEAN member states' role",Permanent Representative of Bangladesh to the United Nations in New York Ambassador Masud Bin Momen urges the NAM member states including the ASEAN neighbours of Myanmar to remain engaged and put in more efforts so that Myanmar authorities do not fail in taking the Rohingyas back.,Rohingya Crisis,Positive,0.3136363636363636
241,PM reaches London,Prime Minister Sheikh Hasina reaches London on an official visit to the United Kingdom.,Bangladesh,Neutral,0.0
242,Ban Ki-Moon wants global adaptation centre in Bangladesh,"Former UN Secretary-General, who is also the chairman of the Global Commission on Adaptation, Ban Ki-moon proposes setting up a global centre for adaptation in Bangladesh for the South and South-East Asia.",Bangladesh,Neutral,0.0
243,UK concerned over rights situation in Bangladesh,The UK has expressed concern over the increased number of extrajudicial killings and further reduction in freedom of expression in Bangladesh.,Bangladesh,Neutral,0.5
244,"Berlin Conference: Dhaka for climate justice, compensation",State Minister for Foreign Affairs Md Shahriar Alam has asked for climate justice that needs to be established and demanded compensation and adequate financial and other assistance for adaptation measures.,Environment,Positive,0.20833333333333331
245,"Summit, JERA Asia ink deal for Matarbari energy project",Bangladesh and Japan sign a deal which will initiate a large energy infrastructure project in Matarbari area of Cox's Bazar.,Bangladesh,Positive,0.42857142857142855
246,Bangladesh gives £66k for monument in UK,"Bangladesh has donated nearly £66,000 for construction of a monument in honour of language veterans at Cardiff in United Kingdom.",Bangladesh,Positive,0.4
247,"Sheikh Selim's son-in-law hurt, grandson missing after SL blasts: Hasina","The son-in-law of Awami League leader Sheikh Selim was injured in Sunday's explosions in Sri Lanka and his grandson has remained missing, Prime Minister Sheikh Hasina says.",Politics,Negative,0.05
248,Bangladesh wins best award in Intl trade fair in Nigeria,"Bangladesh High Commission receives Best Foreign Participant Award at Kaduna International Trade Fair in Abuja, Nigeria.",Bangladesh,Positive,0.37299999999999994
249,Malaysian Rohingya activist nominated for US award,"Sharifah Shakirah, who helps improve the lives of Rohingya women in Malaysia, has been nominated as Malaysia's candidate for the US Department of State's International Women of Courage award.",Rohingya Crisis,Neutral,0.0
250,Quader will return home in two weeks: Hanif,Ruling Awami League casts a bright light on the condition of its General Secretary Obaidul Quader and says he will return home in a week or two.,Politics,Positive,0.6666666666666666
251,Angelina Jolie visits refugee camp,UNHCR special envoy and US film star Angelina Jolie has been visiting Rohingya refugee camps in Teknaf upazila of Cox's Bazar.,Rohingya Crisis,Positive,0.5714285714285714
252,Bangladesh 2nd largest economy in South Asia,"Bangladesh has been ranked 41st among the largest economies in the world in 2019, up from the 43rd position since last year, according to an analysis by a UK based think tank.",Front Page,Neutral,0.06666666666666667
253,People should stand against violence: Fakhrul,BNP Secretary General Mirza Fakhrul Islam Alamgir calls upon the people of the country to stand against the violence spree centering the December 30 election.,JS Polls 2018,Positive,0.5
254,EU polls experts arrive tomorrow,A two-member high-power European Union (EU) election expert mission will arrive in Dhaka to monitor the upcoming general elections.,Politics,Positive,0.25
255,"'Can't eat, can't sleep': Rohingya on Myanmar repatriation list","For Nurul Amin, a Rohingya Muslim living in a refugee camp in Bangladesh, the days since learning he and his family were among a group of people set to potentially be repatriated to Myanmar have been among the most frightening since they fled their home.",Rohingya Crisis,Neutral,0.8333333333333334
256,Should do more to fight Myanmar violence: Facebook,Facebook Inc says a human rights report it commissioned on its presence in Myanmar showed it has not done enough to prevent its social network from being used to incite violence.,Rohingya Crisis,Positive,0.2222222222222222
257,'Insurance gap' poses threats to poor nations,"Disaster-prone developing nations, including Bangladesh and Indonesia, are exposed to crippling losses when storms, floods or earthquakes strike because they suffer from a dangerous lack of insurance, industry experts said yesterday.",Back Page,Negative,0.9
258,Tasneem made Bangladesh High Commissioner to the UK,"The Government decides to appoint Saida Muna Tasneem, currently serving as the Ambassador of Bangladesh to the Kingdom of Thailand, as the new High Commissioner of Bangladesh to the United Kingdom.",Bangladesh,Positive,0.46484848484848484
259,Global community expects Hasina to win next election,Heads of state and different international agencies hoped that Prime Minister Sheikh Hasina would form the government again winning the next general election for the continuity of development and democracy.,Back Page,Positive,0.37
260,Tool ripe for abuse: HRW,"The Digital Security Act, which replaces the much-criticised Information and Communication Technology Act, retains the most problematic provisions of the ICT law and adds more provisions criminalising peaceful speech, Human Rights Watch said yesterday.",Politics,Positive,0.32
261,UN has 'no right to interfere',"Myanmar's powerful army chief says the United Nations has no right to interfere in his country's sovereignty, a week after UN investigators called for him and other top generals to be prosecuted for ""genocide"" against the Rohingya.",Rohingya Crisis,Positive,0.6026785714285714
262,66% support Sheikh Hasina,"Around 66 percent of the respondents support Prime Minister Sheikh Hasina as the PM, according to a survey by the International Republican Institute (IRI).",Back Page,Neutral,0.0
263,Outrage as 2 Reuters journos jailed for 7 yrs,"Two Reuters journalists accused of breaching Myanmar's state secrets law while reporting on a massacre of Rohingya Muslims were jailed for seven years yesterday, fuelling international outrage a week after the army was accused of genocide.",Rohingya Crisis,Neutral,0.0
264,Joy justifies Shahidul's arrest,Prime Minister Sheikh Hasina's ICT Affairs Adviser and son Sajeeb Wazed Joy calls “appropriate” photographer Shahidul Alam's arrest saying he spread rumours instigating violence during the last month's student protests demanding road safety.,Politics,Positive,0.19166666666666665
265,"Road Safety Movement: Halt 'arbitrary arrests', try attackers","Human Rights Watch yesterday urged the Bangladesh government to halt “arbitrary arrests, prosecute those involved in violent attacks, and immediately and unconditionally release people it has thrown in jail just for speaking out”.",Back Page,Negative,0.425
266,Bus drivers say accidents not entirely their fault,"Drivers, mostly overworked and underpaid, are often blamed for Bangladesh's high traffic casualty rate - road accidents kill or injure at least five people an hour in the country - and the resentment against them has been aggravated by the deaths of the two students last Friday.",Country,Positive,0.37666666666666665
267,Indian Home Minister Rajnath Singh arrives,Indian Minister of Home Affairs Rajnath Singh arrives in Dhaka on a three-day official visit.,Bangladesh,Neutral,0.0
268,Dhaka-Kuala Lumpur to sign MoU on defense training,Bangladesh and Malaysia prepare to sign a Memorandum of Understanding (MoU) on defense training and technical cooperation.,Bangladesh,Neutral,0.1
